Document_ID,Document Name,Summary,Rule(s),Filed by,Response Allowed,Modifier?,Response ID,Response,Rule,Time to Respond
PET.COLOR,A petition from Applicant to accept Color Drawings or Color Photographs,"USPTO generally requires all imagines to be black and white. If petitioned, however, applicant may submit and the PTO may choose to accept color drawings, such as in the case where color is an integral part of embodiments",,Applicant,,,,,,
C.AD.PAIR,Change of Address via Patent Application Information Retrieval (PAIR),Simple change of address form ,,PTO,,,,,,
A.QU,Response after Ex Parte Quayle Action,"issued when there are minor issues to be resolved in a patent application that is otherwise in condition for allowance. Prosecution on the merits is closed, meaning that substantive examination has concluded.",,Applicant,,,,,,
PATENT.GRANT,Copy of a Patent Grant,,,PTO,,,,,,
RFN.REQ,Refund Request,Request refund from PTO for overpayment,,Applicant,,,,,,
FAI.REQ,First Action Interview - Enrollment Request,,,Applicant,,,,,,
COCOUT,Certificate of Correction - Post Issue Communication,"Certificate of Correction, sent pursuant to Request for Certificate of Correction",,PTO,,,,,,
PET.DEC.OIPE,Petition decision routed to the Office of  Patent Application Processing(OPAP) to act on the decision or continue prosecution,,,,,,,,,
PEFN,Pre-Exam Formalities Notice,,,,,,,,,
NTC.PUB.DATE,Notice of New or Revised Publication Date,Simple notice that there will be a new or revised projected publication date. ,,PTO,,,,,,
TR.PROV,Provisional Cover Sheet (SB16),Cover sheet containing info about provisional filing,,Applicant,,,,,,
SPEC.NE,Specification-Amendment Not Entered,,,,,,,,,
INTV.SUM.EX,Examiner initiated interview summary (PTOL-413B),,,PTO,,,,,,
IMIS,Miscellaneous Internal Document,,,,,,,,,
PG.NONPUB.RQ,Nonpublication request from applicant,Request that application not be published,,Applicant,,,,,,
M865,Letter Requesting Interview with Examiner,Applicant initiates request to have intervewi with examiner,,Applicant,,,,,,
ROCKET,"Request for Expedited Processing, Design Rocket Docket",For Design Patents. Request by applicant for expedited processing,,Applicant,,,,,,
QPIDS.REQ,Quick Path Information Disclosure Statement,,,Applicant,,,,,,